{"actor_id":"actor_123e4567-e89b-42d3-a456-426614174001","capture_id":"capture_123e4567-e89b-42d3-a456-426614174101","receipt":{"kind":"routing","payload":{"capture_id":"capture_123e4567-e89b-42d3-a456-426614174101","space_id":"space_123e4567-e89b-42d3-a456-426614174004"},"receipt_id":"receipt_123e4567-e89b-42d3-a456-426614174122","recorded_at":"2026-08-30T12:04:00Z","sha256":"8f292d728aa2ef191d1433e0b7dc65fe2477f0564570501c4b0dd963cce8c383","subject_id":"capture_123e4567-e89b-42d3-a456-426614174101"},"recorded_at":"2026-08-30T12:04:00Z","role_claim":{"actor_id":"actor_123e4567-e89b-42d3-a456-426614174001","capabilities":["capture.accept","space.write"],"role_claim_id":"role_claim_123e4567-e89b-42d3-a456-426614174003","role_id":"role_123e4567-e89b-42d3-a456-426614174002","tenant_id":"tenant_123e4567-e89b-42d3-a456-426614174000"},"route_id":"route_123e4567-e89b-42d3-a456-426614174012","schema_version":1,"space_id":"space_123e4567-e89b-42d3-a456-426614174004","supersedes":null,"tenant_id":"tenant_123e4567-e89b-42d3-a456-426614174000"}